title,link,source,date
Inside YouTube’s world of forgotten videos,https://www.bbc.com/future/article/20250306-inside-youtubes-hidden-world-of-forgotten-videos,BBC,2025-03-07
"SpaceX rocket explodes, raining debris from sky for second time in a row",https://www.bbc.com/news/articles/cj92wgeyvzzo,BBC,2025-03-07
Tech Decoded,https://cloud.email.bbc.com/techdecoded-newsletter-signup?&at_bbc_team=studios&at_medium=display&at_objective=acquisition&at_ptr_type=&at_ptr_name=bbc.comhp&at_format=Module&at_link_origin=homepage&at_campaign=techdecoded&at_campaign_type=owned,BBC,2025-03-07
Are Scottish students using AI to cheat their way to a degree?,https://www.bbc.com/news/articles/ckg88kk1n8jo,BBC,2025-03-07
Newly discovered part of immune system could unlock wealth of antibiotics,https://www.bbc.com/news/articles/cpv4jww3r4eo,BBC,2025-03-07
"SpaceX rocket explodes, raining debris from sky for second time in a row",https://www.bbc.com/news/articles/cj92wgeyvzzo,BBC,2025-03-07
Deep-sea mining tech advances but doubts remain,https://www.bbc.com/news/articles/cg45zwe0v0ro,BBC,2025-03-07
How fire changed Notre-Dame’s unique voice,https://www.bbc.com/future/article/20250306-notre-dame-does-the-cathedral-sound-the-same-now-it-has-reopened-following-the-destructive-fire,BBC,2025-03-07
Private spacecraft lands on Moon - but may be on its side,https://www.bbc.com/news/articles/c871eeez0yzo,BBC,2025-03-07
Tech Decoded,https://cloud.email.bbc.com/techdecoded-newsletter-signup?&at_bbc_team=studios&at_medium=display&at_objective=acquisition&at_ptr_type=&at_ptr_name=bbc.comhp&at_format=Module&at_link_origin=homepage&at_campaign=techdecoded&at_campaign_type=owned,BBC,2025-03-07
